{
  "$schema": "http://json-schema.org/draft-07/schema#",
  "$id": "https://github.com/nickpclarke/AgentArmy/templates/image-schema.json",
  "title": "AgentArmy Image Manifest",
  "description": "Declarative spec for a platform container image deliverable. One image.json sits at the root of an image directory (templates/<name>-image/ in the hub, or a spoke repo root) and is validated + exercised by `node tools/agentarmy-doctor.mjs image <dir>`. It captures the 'rigor' of the AgentArmy Image Standard: a correct-by-default image, multi-service stacks (e.g. app + Postgres), shimmed packages, a one-command external test CLI, an external doctor that proves the image, and a deploy lane. See docs/image-standard.md.",
  "type": "object",
  "additionalProperties": false,
  "required": ["name", "kind", "base", "services", "doctor"],
  "properties": {
    "$schema": { "type": "string" },
    "name": {
      "type": "string",
      "pattern": "^[a-z][a-z0-9-]{1,63}$",
      "description": "Image identity, kebab-case (e.g. backend-core-dbos, agentarmy-arcadedb)."
    },
    "kind": {
      "type": "string",
      "enum": ["single", "app+db", "multi-service"],
      "description": "single = one service; app+db = an app plus a companion datastore (e.g. Postgres/ArcadeDB); multi-service = three or more cooperating services."
    },
    "base": {
      "type": "string",
      "description": "Primary base image, digest-pinned (image@sha256:...). For multi-service, this is the image being authored; companion services declare their own `image`."
    },
    "description": { "type": "string" },
    "owner": {
      "type": "string",
      "description": "Where this image lives / who owns it (e.g. 'hub template', 'backend-core spoke')."
    },
    "tier": {
      "type": "string",
      "enum": ["platform", "application", "function"],
      "description": "Container tier per ARC-ADR-023 (docs/decisions/ARC-ADR-023-container-tiering-strategy.md). 'platform' = slow lifecycle, has state (DBs, brokers, ontology stores); 'application' = one container per spoke, stateless, rolling deploys; 'function' = small stateless workers / sidecars / one-shots, independently rolled out. Optional but recommended on all new manifests; the fleet-heartbeat groups its container inventory by this field."
    },
    "services": {
      "type": "array",
      "minItems": 1,
      "description": "The compose services that make up the deliverable. Exactly the units `setup.sh` brings up.",
      "items": {
        "type": "object",
        "additionalProperties": false,
        "required": ["name"],
        "properties": {
          "name": { "type": "string" },
          "image": { "type": "string", "description": "Pull this image (mutually exclusive with build)." },
          "build": { "type": "string", "description": "Build context path (mutually exclusive with image)." },
          "role": {
            "type": "string",
            "description": "Free-text role, e.g. 'api', 'dbos-system-db', 'graph-db'. Helps the doctor reason about companions."
          },
          "ports": {
            "type": "array",
            "items": { "type": "string", "pattern": "^[0-9]+:[0-9]+$" },
            "description": "host:container port maps. The doctor uses the host port for http healthchecks."
          },
          "healthcheck": { "$ref": "#/definitions/healthcheck" },
          "entrypointModes": {
            "type": "array",
            "items": { "type": "string" },
            "description": "Dispatch verbs the entrypoint understands, e.g. ['serve','test','dbos']."
          },
          "env": { "type": "object", "description": "Non-secret env defaults for this service." },
          "volumes": { "type": "array", "items": { "type": "string" } }
        },
        "oneOf": [
          { "required": ["image"] },
          { "required": ["build"] }
        ]
      }
    },
    "secrets": {
      "type": "array",
      "description": "Secrets the stack consumes. Never values — only the wiring. Prefer *_FILE (mounted file) over a plain env var.",
      "items": {
        "type": "object",
        "additionalProperties": false,
        "required": ["name"],
        "properties": {
          "name": { "type": "string" },
          "env": { "type": "string", "description": "Plain env var that carries the value." },
          "fileEnv": { "type": "string", "description": "Preferred: env var pointing at a mounted secret file (*_FILE)." },
          "description": { "type": "string" }
        }
      }
    },
    "shims": {
      "type": "object",
      "additionalProperties": false,
      "description": "Extra packages layered onto the base image (the 'shim onto it' lane). Keep deliberate and reviewed.",
      "properties": {
        "apt": { "type": "array", "items": { "type": "string" } },
        "pip": { "type": "array", "items": { "type": "string" } },
        "note": { "type": "string" }
      }
    },
    "baked": {
      "type": "array",
      "description": "Config/posture baked into the image so a fresh container is correct-by-default.",
      "items": {
        "type": "object",
        "additionalProperties": false,
        "required": ["path"],
        "properties": {
          "path": { "type": "string" },
          "purpose": { "type": "string" }
        }
      }
    },
    "setup": {
      "type": "object",
      "additionalProperties": false,
      "description": "The one-command external test CLI (gen secrets -> up -> wait healthy -> doctor -> wiring; --down to tear down).",
      "properties": {
        "sh": { "type": "string", "description": "POSIX entry, e.g. ./setup.sh" },
        "ps1": { "type": "string", "description": "PowerShell entry, e.g. ./setup.ps1" }
      }
    },
    "doctor": {
      "type": "object",
      "additionalProperties": false,
      "required": ["cmd"],
      "description": "The external verifier that proves the running image from the outside (the ArcadeDB-doctor equivalent).",
      "properties": {
        "cmd": { "type": "string", "description": "Command/script that exits non-zero on failure, e.g. scripts/dbos-doctor.sh or `node ../../tools/agentarmy-doctor.mjs arcadedb`." },
        "proves": {
          "type": "array",
          "items": { "type": "string" },
          "description": "What the doctor asserts, e.g. ['readiness','durable-workflow','crash-recovery']."
        },
        "description": { "type": "string" }
      }
    },
    "deploy": {
      "type": "object",
      "additionalProperties": false,
      "description": "Cloud deploy lane for the image.",
      "properties": {
        "target": { "type": "string", "enum": ["aca", "cloud-run", "k8s", "none"] },
        "bicep": { "type": "string" },
        "workflow": { "type": "string" },
        "notes": { "type": "string" }
      }
    },
    "volumes": {
      "type": "array",
      "items": { "type": "string" },
      "description": "Named volumes that must persist together (e.g. config + data)."
    },
    "contract": {
      "type": "array",
      "description": "Interface contracts for the APIs this image exposes (the fleet contract-first rule applied to images). Every interface-exposing service should bind to a versioned spec registered in docs/contracts.md and, where possible, a Postman mock for parallel consumers.",
      "items": {
        "type": "object",
        "additionalProperties": false,
        "required": ["type"],
        "properties": {
          "service": { "type": "string", "description": "Which service this interface belongs to." },
          "type": { "type": "string", "enum": ["openapi", "asyncapi", "graphql", "grpc", "upstream", "prose"], "description": "upstream = a vendor API we don't author; prose = a markdown contract pending formalization." },
          "spec": { "type": "string", "description": "Repo-relative path to the spec file, or a URL for an upstream/vendor API." },
          "registry": { "type": "string", "description": "Where it's registered, e.g. docs/contracts.md (the row name)." },
          "mock": { "type": "string", "description": "Postman (or other) mock URL for parallel consumers." },
          "governingAdr": { "type": "string", "description": "e.g. ARC-ADR-005." },
          "note": { "type": "string" }
        }
      }
    }
  },
  "definitions": {
    "healthcheck": {
      "type": "object",
      "additionalProperties": false,
      "description": "How readiness is determined. Use http (path probed on the host port) or cmd (run inside the container).",
      "properties": {
        "http": { "type": "string", "description": "Path or full URL probed for readiness, e.g. /health/ready." },
        "expect": { "type": "integer", "description": "Expected HTTP status (default 200)." },
        "cmd": { "type": "string", "description": "In-container readiness command, e.g. 'pg_isready -U dbos'." }
      },
      "anyOf": [
        { "required": ["http"] },
        { "required": ["cmd"] }
      ]
    }
  }
}
