{
  "$schema": "../image-schema.json",
  "name": "agentarmy-hmac-verify",
  "kind": "single",
  "base": "python:3.12-slim",
  "description": "HMAC-signature verification sidecar — extracts a reusable function-tier pattern out of templates/event-bridge-image/ where it lives today. Sits as an ingress sidecar in front of any spoke that accepts signed webhooks (GitHub, Stripe, Postmark, custom). Verifies `X-*-Signature*` constant-time using a shared secret resolved from Azure Key Vault, then forwards the verified request to the spoke. Scaffolded as part of the contract-backlog PR; real implementation lifts the constant-time verifier from event-bridge.",
  "owner": "hub template",
  "tier": "function",
  "services": [
    {
      "name": "hmac-verify",
      "build": ".",
      "role": "ingress-sidecar",
      "ports": ["8083:8083"],
      "healthcheck": { "http": "/healthz", "expect": 200 },
      "entrypointModes": ["sidecar"]
    }
  ],
  "shims": {
    "apt": ["curl", "ca-certificates"],
    "pip": ["fastapi", "uvicorn[standard]", "cryptography", "httpx"],
    "note": "stdlib hmac.compare_digest is the load-bearing primitive (constant-time, secure-by-default). cryptography pulled for KV-resolved secrets only. Mirrors the security posture of event-bridge."
  },
  "baked": [
    { "path": "scripts/verify-sidecar.py", "purpose": "FastAPI app verifying HMAC headers per provider config (github | stripe | postmark | custom) via stdlib hmac.compare_digest (constant-time). Replay protection by delivery-id with REPLAY_TTL_SECONDS window. Proxies verified requests to UPSTREAM_URL; verify-only mode when unset." },
    { "path": "scripts/hmac-doctor.sh", "purpose": "4-check doctor: /healthz 200; bad sig -> 401; good sig -> 200 + upstream echo recorded the request (5 PASS lines); same delivery-id twice -> second is 409." },
    { "path": "scripts/echo-upstream.py", "purpose": "Tiny stdlib HTTP recorder used only by the doctor to prove the proxy hop actually happened — records the last POST body, GET /last returns it." }
  ],
  "setup": { "sh": "setup.sh" },
  "doctor": {
    "cmd": "scripts/hmac-doctor.sh",
    "proves": ["readiness", "rejects-bad-sig", "accepts-good-sig", "replay-protection"],
    "description": "/healthz returns 200; bad sig -> 401; good sig -> 200 AND upstream echo recorded the proxied request; replay of same delivery-id within TTL -> 409. Verified locally: 5/5 PASS against agentarmy-hmac-verify:local + agentarmy stdlib echo upstream."
  },
  "deploy": {
    "target": "aca",
    "notes": "Deployed as a sidecar in front of any spoke that accepts signed webhooks. The webhook-receiver spec (contracts/webhook-receiver.openapi.yaml) is the GitHub-specific consumer; this image generalizes."
  },
  "volumes": [],
  "contract": [
    { "service": "hmac-verify", "type": "prose", "registry": "docs/contracts.md", "governingAdr": "ARC-ADR-022", "note": "No new contract — this image realizes the verification half of the webhook-receiver contract for any signed-webhook source." }
  ]
}
