{
  "$schema": "../image-schema.json",
  "name": "agentarmy-runbook-orchestrator",
  "kind": "single",
  "base": "python:3.12-slim@sha256:090ba77e2958f6af52a5341f788b50b032dd4ca28377d2893dcf1ecbdfdfe203",
  "description": "AgentArmy automated runbook orchestrator — executes BPMN 2.0 XML processes and OASIS CACAO 2.0 security playbooks against one shared execution kernel, responding to event-bus triggers. Isolated by design: the kernel depends only on runbook files (stdlib + defusedxml). Serve mode subscribes each event-triggered runbook to a fleet.* NATS subject (ARC-ADR-022) and runs it on a matching CloudEvent. Safe-orchestrator posture (ARC-ADR-031): emits observable events, HITL-gates manual steps, dry-runs shell commands. The container listens on 8080; the manifest + example publish it on host 8088 to coexist with the platform event-bridge (which owns host 8080).",
  "owner": "hub template",
  "tier": "function",
  "services": [
    {
      "name": "orchestrator",
      "build": ".",
      "role": "api",
      "ports": ["8088:8080"],
      "healthcheck": { "http": "/healthz", "expect": 200 },
      "entrypointModes": ["serve", "run", "validate"],
      "env": { "RUNBOOK_DIR": "/runbooks", "STREAM_NAME": "FLEET", "STREAM_SUBJECTS": "fleet.>" },
      "volumes": ["../runbooks:/runbooks:ro"]
    }
  ],
  "shims": {
    "apt": ["curl", "ca-certificates"],
    "pip": ["defusedxml", "fastapi", "uvicorn[standard]", "pydantic", "nats-py"],
    "note": "defusedxml hardens BPMN XML parsing (XXE / billion-laughs) — the kernel is otherwise stdlib-only and runs standalone with zero network. fastapi/uvicorn/nats-py are the optional serve layer; with no reachable NATS the helper degrades to control-API-only."
  },
  "baked": [
    { "path": "entrypoint.sh", "purpose": "serve (default, uvicorn) | run <file> | validate <file> | <cmd>." },
    { "path": "scripts/ir.py", "purpose": "Shared intermediate representation (annotated directed graph) both parsers emit." },
    { "path": "scripts/bpmn_parser.py", "purpose": "BPMN 2.0 XML -> IR (defusedxml; stdlib fallback for dev)." },
    { "path": "scripts/cacao_parser.py", "purpose": "OASIS CACAO 2.0 JSON -> IR." },
    { "path": "scripts/validators.py", "purpose": "Structural pre-flight validation for both formats." },
    { "path": "scripts/runbook_engine.py", "purpose": "Execution kernel + SafeExecutor (safe-orchestrator posture) + CLI." },
    { "path": "scripts/triggers.py", "purpose": "RunbookIndex: scan RUNBOOK_DIR, derive fleet.* trigger subjects." },
    { "path": "scripts/server.py", "purpose": "Serve mode: control API + JetStream trigger dispatcher; emits fleet.runbook.* CloudEvents." },
    { "path": "runbooks/", "purpose": "Bundled fixtures: block-mac (CACAO), phishing-response (CACAO parallel+if+manual), incident-response (BPMN message-start + gateway)." }
  ],
  "setup": { "sh": "setup.sh", "ps1": "setup.ps1" },
  "doctor": {
    "cmd": "scripts/runbook-doctor.sh",
    "proves": ["readiness", "all-runbooks-valid", "event-trigger-fires", "rejects-invalid"],
    "description": "/healthz 200 with trigger subjects subscribed; every indexed runbook valid; a CloudEvent on fleet.siem.phishing makes the phishing playbook run and emit a fleet.runbook.completed event (the responds-to-events promise, end-to-end); a malformed file fails `validate` non-zero."
  },
  "deploy": {
    "target": "aca",
    "notes": "Internal worker — no public ingress required. Subscribes to the fleet's NATS JetStream (middle-core per ARC-ADR-001). Mount the runbook directory (Container Apps volume / Azure Files) or bake it into the image; the control API can stay cluster-internal."
  },
  "volumes": [],
  "contract": [
    { "service": "orchestrator", "type": "openapi", "spec": "../../contracts/runbook-orchestrator.openapi.yaml", "registry": "docs/contracts.md", "governingAdr": "ARC-ADR-031", "note": "Serve-mode control API: GET /healthz, GET /runbooks, POST /runbooks/{id}/trigger." },
    { "service": "orchestrator", "type": "prose", "registry": "docs/contracts.md", "governingAdr": "ARC-ADR-031", "note": "Trigger surface: consumes fleet.* CloudEvents (subject derived from each runbook's start trigger); emits fleet.runbook.command + fleet.runbook.completed. Governed by ARC-ADR-022 (event bus) + ARC-ADR-031." }
  ]
}
