{
  "$schema": "../image-schema.json",
  "name": "agentarmy-arcadedb",
  "kind": "single",
  "base": "arcadedata/arcadedb:26.5.1",
  "description": "Thin derived ArcadeDB image, correct-by-default: read-only MCP posture, platform_reader service user, knowledge database, and doctor-stub types baked in.",
  "owner": "hub template",
  "services": [
    {
      "name": "arcadedb",
      "build": ".",
      "role": "graph-db",
      "ports": ["2480:2480"],
      "healthcheck": { "http": "/api/v1/ready", "expect": 204 }
    }
  ],
  "secrets": [
    { "name": "arcadedb_root_password", "env": "ARCADEDB_ROOT_PASSWORD", "fileEnv": "ARCADEDB_ROOT_PASSWORD_FILE", "description": "root admin; bootstrap only." },
    { "name": "arcadedb_service_password", "env": "ARCADEDB_SERVICE_PASSWORD", "fileEnv": "ARCADEDB_SERVICE_PASSWORD_FILE", "description": "platform_reader read-only user; same value clients read via ARCADEDB_PASSWORD_FILE." }
  ],
  "baked": [
    { "path": "config/mcp-config.json", "purpose": "Read-only MCP posture (all mutations false, scoped to platform_reader), re-applied every boot." },
    { "path": "bootstrap/doctor-stub-schema.json", "purpose": "IF NOT EXISTS Chunk/StoredObject/IngestJob document types so the doctor passes." }
  ],
  "setup": { "sh": "setup.sh", "ps1": "setup.ps1" },
  "doctor": {
    "cmd": "node ../../tools/agentarmy-doctor.mjs arcadedb",
    "proves": ["readiness", "schema-stubs", "mcp-posture"],
    "description": "Hits /api/v1/ready and queries the stub types as platform_reader; MCP posture is read-only and reachable."
  },
  "deploy": {
    "target": "aca",
    "notes": "ACA deploy lane lives under deploy/ (bicep + deploy.yml); copy into the spoke to build/push (this repo ships no registry push pipeline)."
  },
  "volumes": ["config", "databases"],
  "contract": [
    { "service": "arcadedb", "type": "upstream", "spec": "https://docs.arcadedb.com/#HTTP-API", "note": "Vendor HTTP/JSON API; the AgentArmy-authored posture is the read-only MCP config (config/mcp-config.json)." },
    { "service": "arcadedb", "type": "prose", "registry": "docs/contracts.md", "note": "Cockpit backend contract is extensions/arcadedb-cockpit/BACKEND_CONTRACT.md (markdown). Formalize as OpenAPI + register if the cockpit API stabilizes." }
  ]
}
